{
  "$schema": "http://json-schema.org/draft-07/schema#",
  "title": "Halo Product Configuration",
  "description": "Configuration for Halo build variants (public/internal)",
  "type": "object",
  "required": ["name", "version", "updateConfig", "authProviders"],
  "properties": {
    "$schema": {
      "type": "string"
    },
    "name": {
      "type": "string",
      "description": "Product name"
    },
    "dataFolderName": {
      "type": "string",
      "description": "Data folder name for per-variant isolation. Controls both the Halo config directory (~/.{dataFolderName}/) and Electron userData directory. Defaults to 'halo' when omitted.",
      "pattern": "^[a-z][a-z0-9-]*$",
      "examples": ["halo", "halo-enterprise"]
    },
    "version": {
      "type": "string",
      "description": "Product version"
    },
    "updateConfig": {
      "type": "object",
      "description": "Auto-update configuration",
      "required": ["provider"],
      "properties": {
        "provider": {
          "type": "string",
          "enum": ["github", "generic"],
          "description": "Update provider type"
        },
        "url": {
          "type": "string",
          "description": "URL for generic provider (empty string = disabled)"
        },
        "owner": {
          "type": "string",
          "description": "GitHub repository owner (required for github provider)"
        },
        "repo": {
          "type": "string",
          "description": "GitHub repository name (required for github provider)"
        }
      },
      "if": {
        "properties": { "provider": { "const": "github" } }
      },
      "then": {
        "required": ["provider", "owner", "repo"]
      }
    },
    "authProviders": {
      "type": "array",
      "description": "Authentication provider configurations",
      "items": {
        "type": "object",
        "required": ["type", "enabled"],
        "properties": {
          "type": {
            "type": "string"
          },
          "displayName": {},
          "description": {},
          "icon": {
            "type": "string"
          },
          "iconBgColor": {
            "type": "string"
          },
          "recommended": {
            "type": "boolean"
          },
          "builtin": {
            "type": "boolean"
          },
          "path": {
            "type": "string"
          },
          "enabled": {
            "type": "boolean"
          }
        }
      }
    },
    "browserPolicy": {
      "type": "object",
      "description": "Browser network access policy. Controls which domains the embedded browser can navigate to. Omit for unrestricted access (default).",
      "properties": {
        "mode": {
          "type": "string",
          "enum": ["allowlist", "blocklist", "unrestricted"],
          "description": "Policy mode: allowlist = only listed domains allowed, blocklist = listed domains blocked, unrestricted = no restrictions"
        },
        "allowlist": {
          "type": "array",
          "items": { "type": "string" },
          "description": "Domain patterns to allow (e.g. \"*.example.com\", \"intranet.corp.com\"). Used when mode is \"allowlist\"."
        },
        "blocklist": {
          "type": "array",
          "items": { "type": "string" },
          "description": "Domain patterns to block. Used when mode is \"blocklist\"."
        },
        "homepage": {
          "type": "string",
          "description": "Default homepage URL for new browser tabs. Falls back to about:blank when policy is active but homepage is not set."
        }
      },
      "required": ["mode"]
    }
  },
  "additionalProperties": false
}
