{
  "$schema": "./product.schema.json",
  "name": "DevX",
  "dataFolderName": "devx",
  "version": "1.0.0",
  "updateConfig": {
    "provider": "github",
    "owner": "openkursar",
    "repo": "devx"
  },
  "authProviders": [
    {
      "type": "github-copilot",
      "displayName": {
        "en": "GitHub Copilot",
        "zh-CN": "GitHub Copilot"
      },
      "description": {
        "en": "Use your Copilot subscription",
        "zh-CN": "使用您的 Copilot 订阅"
      },
      "icon": "github",
      "iconBgColor": "#24292e",
      "recommended": false,
      "builtin": true,
      "enabled": true
    },
    {
      "type": "custom",
      "displayName": {
        "en": "Custom API",
        "zh-CN": "自定义 API"
      },
      "description": {
        "en": "Claude / OpenAI compatible",
        "zh-CN": "兼容 Claude / OpenAI"
      },
      "icon": "key",
      "iconBgColor": "#da7756",
      "recommended": false,
      "builtin": true,
      "enabled": true
    }
  ]
}
